H2986,Stanford Health Care Advantage,STANFORD HEALTHCARE ADVANTAGE,Stanford Health Care,Not enough data available,CMS Found Issues with Plan’s Data,CMS Found Issues with Plan’s Data,Not enough data available,No data available,CMS Found Issues with Plan’s Data,No data available,0:16,No data available,98%,0.00%,Not enough data available,Not enough data available,Not enough data available,Not enough data available,No data available,No data available,No data available,No data available,No data available,No data available,No data available,Not enough data available,CMS Found Issues with Plan’s Data,CMS Found Issues with Plan’s Data,CMS Found Issues with Plan’s Data,CMS Found Issues with Plan’s Data,No data available,No data available,0.80%,0:13,No data available,No data available,100%,No data available,No data available,No data available,0:09,96,No data available,No data available,No data available,No data available,No data available,90%,Plan too small to be measured,No data available,No data available,No data available,No data available,No data available
H3018,Centers Plan for FIDA Care Complete,"CENTERS PLAN FOR HEALTHY LIVING, LLC","Centers Plan for Healthy Living, LLC",Not enough data available,Not enough data available,Not enough data available,Not enough data available,No data available,Not enough data available,No data available,0:35,No data available,Not enough data available,1.55%,Not enough data available,Not enough data available,Not enough data available,Not enough data available,No data available,No data available,No data available,No data available,No data available,No data available,No data available,Not enough data available,Insufficient data,Not enough data available,Not enough data available,Not enough data available,No data available,No data available,0.00%,0:04,No data available,No data available,100%,No data available,No data available,No data available,0:05,99,No data available,No data available,No data available,No data available,No data available,No data available,Plan too small to be measured,No data available,No data available,No data available,No data available,No data available
H3054,Constellation Health,"CONSTELLATION HEALTH, LLC.","Constellation Health, LLC.",74%,49%,Not enough data available,93%,72%,Not enough data available,No data available,0:59,No data available,99%,2.31%,25%,64%,24%,0%,No data available,No data available,No data available,No data available,No data available,No data available,Not enough data available,7%,Insufficient data,Not enough data available,Not enough data available,Not enough data available,100%,100.00%,2.31%,0:59,5%,0.41%,96%,99,No data available,No data available,0:24,99,No data available,No data available,No data available,No data available,73%,No data available,CMS identified issues with this plan's data,17%,36%,12%,20%,23%
H3067,Virginia Premier CompleteCare,"VIRGINIA PREMIER HEALTH PLAN, INC.",Virginia Cwlth University Hlth System Authority,40%,47%,Not enough data available,92%,No data available,Not enough data available,Not enough data available,0:04,57%,88%,0.00%,73%,83%,38%,4%,54%,48,36,88,Not enough data available,62,No data available,10%,Insufficient data,Not enough data available,Not enough data available,Not enough data available,No data available,69.23%,0.00%,0:04,5%,0.45%,100%,99,21.84%,Not enough data available,0:14,99,26.7%,0.0%,44,38,74%,No data available,CMS identified issues with this plan's data,No data available,No data available,No data available,No data available,No data available
H3071,"Community Care Alliance of Illinois, NFP","COMMUNITY CARE ALLIANCE OF ILLINOIS, NFP",Family Health Network,33%,38%,Not enough data available,88%,42%,Not enough data available,Not enough data available,0:21,50%,85%,1.61%,70%,92%,30%,3%,62%,51,42,94,Not enough data available,71,Not enough data available,17%,Insufficient data,Not enough data available,Not enough data available,Not enough data available,100%,No data available,2.40%,0:19,6%,0.48%,100%,99,No data available,Not enough data available,0:08,99,No data available,0.0%,47,41,74%,99%,CMS identified issues with this plan's data,26%,54%,29%,22%,24%
H3107,UnitedHealthcare,"OXFORD HEALTH PLANS (NJ), INC.","UnitedHealth Group, Inc.",51%,47%,86%,93%,72%,40%,Not enough data available,0:14,63%,94%,1.59%,70%,77%,43%,3%,60%,55,48,82,Not enough data available,54,48%,5%,55,73%,53%,77%,100%,100.00%,1.59%,0:14,4%,0.32%,100%,99,14.36%,Not enough data available,0:10,99,No data available,No data available,47,26,73%,98%,CMS identified issues with this plan's data,No data available,No data available,No data available,No data available,No data available
H3113,UnitedHealthcare,"OXFORD HEALTH PLANS (NJ), INC.","UnitedHealth Group, Inc.",35%,Not enough data available,Not enough data available,96%,61%,Not enough data available,Not enough data available,0:06,53%,99%,0.88%,74%,92%,33%,4%,64%,62,56,87,Not enough data available,Not enough data available,Not enough data available,CMS Found Issues with Plan’s Data,Insufficient data,Not enough data available,Not enough data available,Not enough data available,No data available,No data available,0.88%,0:06,6%,0.36%,100%,99,14.52%,Not enough data available,0:10,99,No data available,No data available,48,41,74%,No data available,1.53,30%,42%,15%,12%,16%
H3129,"North Shore-LIJ Health Plan, Inc.","NORTH SHORE-LIJ HEALTH PLAN, INC.","North Shore-LI Jewish Health System, Inc.",Not enough data available,Not enough data available,Not enough data available,Not enough data available,No data available,Not enough data available,No data available,0:18,No data available,Not enough data available,0.78%,Not enough data available,Not enough data available,Not enough data available,Not enough data available,No data available,No data available,No data available,No data available,No data available,No data available,No data available,Not enough data available,Insufficient data,Not enough data available,Not enough data available,Not enough data available,No data available,No data available,0.78%,0:18,No data available,No data available,100%,No data available,No data available,No data available,0:13,100,No data available,No data available,No data available,No data available,No data available,No data available,Plan too small to be measured,No data available,No data available,No data available,No data available,No data available
H3132,AHF,"AHF MCO OF FLORIDA, INC.",AIDS Healthcare Foundation,Not enough data available,81%,Not enough data available,98%,Not enough data available,Not enough data available,94%,0:37,86%,98%,0.79%,Not enough data available,Not enough data available,22%,0%,73%,52,41,93,95,63,Not enough data available,39%,Insufficient data,79%,Not enough data available,Not enough data available,0%,100.00%,0.00%,0:15,11%,0.72%,100%,99,No data available,84,0:07,100,No data available,0.0%,65,36,73%,No data available,2.59,36%,43%,15%,33%,33%
H3152,Aetna Medicare,AETNA HEALTH INC. (NJ),Aetna Inc.,50%,57%,94%,91%,83%,44%,92%,0:49,79%,96%,0.69%,80%,86%,41%,4%,61%,54,42,80,Not enough data available,48,41%,23%,64,78%,66%,85%,100%,100.00%,0.69%,0:49,4%,0.81%,100%,99,14.93%,Not enough data available,0:42,98,0.0%,0.0%,41,19,75%,98%,CMS identified issues with this plan's data,21%,28%,31%,19%,11%
H3154,Horizon Blue Cross Blue Shield of New Jersey,HORIZON INSURANCE COMPANY,"Horizon Healthcare Services, Inc.",58%,57%,92%,90%,74%,41%,91%,0:38,71%,95%,1.59%,73%,82%,57%,7%,45%,44,33,81,Not enough data available,51,45%,12%,191,74%,59%,78%,95%,80.00%,0.00%,0:09,5%,0.22%,100%,100,5.56%,Not enough data available,0:06,99,0.0%,0.0%,41,22,75%,98%,1.18,20%,23%,43%,16%,12%
H3156,AmeriHealth 65 Preferred HMO,"AMERIHEALTH HMO, INC.","Independence Health Group, Inc.",40%,53%,91%,87%,73%,Not enough data available,91%,0:37,71%,95%,1.28%,76%,82%,44%,4%,48%,41,28,82,Not enough data available,49,36%,20%,71,77%,59%,78%,81%,83.33%,1.28%,0:37,4%,0.17%,100%,99,16.67%,81,0:09,99,0.0%,0.0%,35,14,76%,97%,1.21,No data available,No data available,No data available,No data available,No data available
H3170,Blue Cross and Blue Shield of Nebraska,"SAPPHIRE EDGE, INC.",Blue Cross Blue Shield of Nebraska,Plan too new to be measured,Plan too new to be measured,Plan too new to be measured,Plan too new to be measured,No data available,Plan too new to be measured,Plan too new to be measured,Plan too new to be measured,Plan too new to be measured,Plan too new to be measured,Plan too new to be measured,Plan too new to be measured,Plan too new to be measured,Plan too new to be measured,Plan too new to be measured,Plan too new to be measured,Plan too new to be measured,Plan too new to be measured,Plan too new to be measured,Plan too new to be measured,Plan too new to be measured,No data available,Plan too new to be measured,Plan too new to be measured,Plan too new to be measured,Plan too new to be measured,Plan too new to be measured,Plan too new to be measured,Plan too new to be measured,Plan too new to be measured,Plan too new to be measured,Plan too new to be measured,Plan too new to be measured,Plan too new to be measured,Plan too new to be measured,Plan too new to be measured,Plan too new to be measured,Plan too new to be measured,Plan too new to be measured,Plan too new to be measured,Plan too new to be measured,Plan too new to be measured,Plan too new to be measured,Plan too new to be measured,Plan too new to be measured,Plan too new to be measured,Plan too new to be measured,Plan too new to be measured,Plan too new to be measured,Plan too new to be measured,Plan too new to be measured
H3204,Presbyterian Senior Care (HMO),PRESBYTERIAN HEALTH PLAN,Presbyterian Healthcare Services,44%,60%,89%,88%,86%,36%,91%,0:52,85%,95%,0.00%,67%,70%,60%,7%,60%,34,35,94,Not enough data available,51,46%,24%,29,66%,56%,86%,100%,75.00%,0.00%,0:52,4%,0.48%,96%,98,8.00%,Not enough data available,0:18,97,No data available,No data available,34,9,73%,95%,2.69,27%,24%,13%,14%,12%
H3206,Presbyterian MediCare PPO,"PRESBYTERIAN INSURANCE COMPANY, INC.",Presbyterian Healthcare Services,Not enough data available,53%,90%,89%,89%,34%,91%,0:52,83%,95%,0.00%,70%,81%,46%,2%,54%,30,29,82,Not enough data available,51,45%,15%,48,70%,60%,86%,100%,No data available,0.00%,0:52,5%,0.46%,96%,98,0.00%,Not enough data available,0:18,97,No data available,No data available,28,9,66%,92%,1.92,12%,46%,38%,9%,9%
H3233,Premier Health Plan,PREMIER HEALTH INSURING CORPORATION,Premier Health Partners,Not enough data available,66%,Not enough data available,93%,No data available,Not enough data available,93%,0:05,80%,96%,0.00%,81%,73%,44%,2%,55%,44,37,93,96,53,No data available,12%,Insufficient data,Not enough data available,Not enough data available,Not enough data available,71%,100.00%,0.00%,0:05,6%,0.29%,100%,102,No data available,Not enough data available,0:18,97,No data available,No data available,33,16,74%,95%,CMS identified issues with this plan's data,20%,56%,13%,11%,13%
H3237,Health Net Cal MediConnect Medicare Medicaid Plan,"HEALTH NET COMMUNITY SOLUTIONS, INC.",Centene Corporation,28%,37%,77%,90%,No data available,24%,Not enough data available,0:09,48%,74%,1.61%,59%,77%,27%,3%,57%,46,35,76,Not enough data available,55,No data available,9%,28,67%,Not enough data available,66%,33%,100.00%,1.61%,0:09,5%,0.06%,100%,99,18.70%,Not enough data available,0:04,99,0.0%,0.0%,44,33,71%,No data available,2.88,No data available,No data available,No data available,No data available,No data available
H3240,Amerigroup Community Care,"AMERIGROUP NEW JERSEY, INC.",Anthem Inc.,32%,59%,Not enough data available,94%,68%,33%,Not enough data available,0:38,57%,95%,1.82%,71%,86%,30%,2%,63%,59,53,85,Not enough data available,56,48%,6%,70,76%,52%,53%,67%,No data available,1.82%,0:38,5%,0.13%,100%,98,No data available,Not enough data available,0:20,99,No data available,0.0%,46,47,76%,No data available,CMS identified issues with this plan's data,34%,50%,18%,26%,14%
H3251,Blue Cross Blue Shield of New Mexico,HEALTH CARE SERVICE CORPORATION,Health Care Service Corporation,33%,55%,94%,85%,85%,31%,90%,0:18,78%,93%,0.00%,74%,83%,23%,2%,51%,36,30,88,Not enough data available,47,44%,41%,34,75%,55%,44%,100%,No data available,0.00%,0:18,4%,0.70%,100%,97,11.29%,Not enough data available,0:05,97,No data available,No data available,29,12,69%,96%,7.25,27%,16%,30%,9%,19%
H3259,BlueCare Plus Tennessee,VOLUNTEER STATE HEALTH PLAN,BlueCross BlueShield of Tennessee,59%,56%,Not enough data available,94%,61%,Not enough data available,90%,0:10,64%,98%,0.63%,68%,82%,24%,1%,55%,48,47,85,Not enough data available,56,45%,23%,Insufficient data,81%,Not enough data available,Not enough data available,100%,100.00%,0.63%,0:10,9%,0.26%,100%,99,No data available,86,0:17,99,0.0%,0.0%,42,36,70%,No data available,4.87,24%,57%,10%,6%,7%
H3262,Fresenius Health Plans,"FRESENIUS HEALTH PLANS OF NEW YORK, INC.",Fresenius Medicare Care AG & Co. KGaA,Plan too new to be measured,Plan too new to be measured,Plan too new to be measured,Plan too new to be measured,No data available,Plan too new to be measured,Plan too new to be measured,Plan too new to be measured,Plan too new to be measured,Plan too new to be measured,Plan too new to be measured,Plan too new to be measured,Plan too new to be measured,Plan too new to be measured,Plan too new to be measured,Plan too new to be measured,Plan too new to be measured,Plan too new to be measured,Plan too new to be measured,Plan too new to be measured,Plan too new to be measured,No data available,Plan too new to be measured,Plan too new to be measured,Plan too new to be measured,Plan too new to be measured,Plan too new to be measured,Plan too new to be measured,Plan too new to be measured,Plan too new to be measured,Plan too new to be measured,Plan too new to be measured,Plan too new to be measured,Plan too new to be measured,Plan too new to be measured,Plan too new to be measured,Plan too new to be measured,Plan too new to be measured,Plan too new to be measured,Plan too new to be measured,Plan too new to be measured,Plan too new to be measured,Plan too new to be measured,Plan too new to be measured,Plan too new to be measured,Plan too new to be measured,Plan too new to be measured,Plan too new to be measured,Plan too new to be measured,Plan too new to be measured,Plan too new to be measured
H3291,PruittHealth Premier (HMO SNP),"PRUITTHEALTH PREMIER, INC.","UNICO Premier, LLC",Plan too new to be measured,Plan too new to be measured,Plan too new to be measured,Plan too new to be measured,No data available,Plan too new to be measured,Plan too new to be measured,0:27,Plan too new to be measured,Plan too new to be measured,0.00%,Plan too new to be measured,Plan too new to be measured,Plan too new to be measured,Plan too new to be measured,Plan too new to be measured,Plan too new to be measured,Plan too new to be measured,Plan too new to be measured,Plan too new to be measured,Plan too new to be measured,No data available,Plan too new to be measured,Plan too new to be measured,Plan too new to be measured,Plan too new to be measured,Plan too new to be measured,Plan too new to be measured,Plan too new to be measured,Plan too new to be measured,Plan too new to be measured,Plan too new to be measured,Plan too new to be measured,Plan too new to be measured,Plan too new to be measured,Plan too new to be measured,Plan too new to be measured,Plan too new to be measured,Plan too new to be measured,Plan too new to be measured,Plan too new to be measured,Plan too new to be measured,Plan too new to be measured,Plan too new to be measured,Plan too new to be measured,Plan too new to be measured,Plan too new to be measured,Plan too new to be measured,Plan too new to be measured,Plan too new to be measured,Plan too new to be measured
H3305,MVP HEALTH CARE,"MVP HEALTH PLAN, INC.","MVP Health Care, Inc.",Not enough data available,59%,99%,94%,88%,36%,93%,1:46,89%,99%,1.54%,82%,88%,40%,1%,48%,35,28,89,94,48,55%,26%,64,81%,58%,90%,100%,No data available,1.54%,1:21,5%,0.84%,100%,100,16.53%,85,0:10,98,No data available,No data available,36,14,80%,94%,0.20,6%,3%,56%,6%,6%
H3307,UnitedHealthcare,"OXFORD HEALTH PLANS (NY), INC.","UnitedHealth Group, Inc.",60%,50%,91%,93%,79%,52%,Not enough data available,0:14,66%,95%,1.17%,74%,80%,44%,5%,60%,65,43,82,Not enough data available,48,42%,9%,49,72%,57%,81%,100%,No data available,1.17%,0:14,4%,0.21%,100%,99,16.73%,Not enough data available,0:10,99,No data available,No data available,58,28,73%,97%,CMS identified issues with this plan's data,31%,42%,31%,15%,17%
H3312,Aetna Medicare,AETNA HEALTH INC. (NY),Aetna Inc.,61%,54%,98%,92%,82%,48%,93%,0:49,67%,96%,0.69%,75%,86%,41%,5%,57%,48,39,77,Not enough data available,52,48%,27%,63,75%,57%,85%,100%,No data available,0.69%,0:49,4%,0.92%,100%,99,19.12%,82,0:42,99,0.0%,6.7%,54,22,73%,97%,2.67,15%,19%,52%,17%,15%
H3314,HIP Health Plan of Greater New York,HEALTH INSURANCE PLAN OF GREATER NEW YORK,"EmblemHealth, Inc.",Not enough data available,Not enough data available,Not enough data available,78%,No data available,Not enough data available,No data available,Not enough data available,No data available,88%,Not enough data available,Not enough data available,Not enough data available,Not enough data available,Not enough data available,No data available,No data available,No data available,No data available,No data available,No data available,No data available,46%,Insufficient data,Not enough data available,Not enough data available,Not enough data available,Plan not required to report measure,Plan not required to report measure,Plan not required to report measure,Plan not required to report measure,Plan not required to report measure,Plan not required to report measure,Plan not required to report measure,Plan not required to report measure,Plan not required to report measure,Plan not required to report measure,Plan not required to report measure,Plan not required to report measure,Plan not required to report measure,Plan not required to report measure,Plan not required to report measure,Plan not required to report measure,Plan not required to report measure,No data available,Plan too small to be measured,No data available,No data available,No data available,No data available,No data available
H3328,Fidelis Care,"THE NEW YORK STATE CATHOLIC HEALTH PLAN, INC.","The New York State Catholic Health Plan, Inc.",83%,70%,98%,94%,70%,56%,91%,1:21,54%,96%,0.00%,78%,83%,46%,11%,65%,57,53,89,91,57,43%,56%,60,75%,73%,66%,100%,100.00%,0.00%,1:21,5%,0.27%,100%,100,12.82%,76,0:13,98,No data available,No data available,52,36,76%,97%,CMS identified issues with this plan's data,22%,34%,15%,17%,12%
H3330,EmblemHealth Medicare HMO,HEALTH INSURANCE PLAN OF GREATER NEW YORK,"EmblemHealth, Inc.",56%,49%,94%,94%,80%,46%,88%,0:59,66%,96%,3.25%,77%,87%,42%,6%,56%,47,39,90,Not enough data available,57,57%,63%,64,74%,55%,71%,74%,50.00%,3.25%,0:59,5%,0.27%,100%,99,14.46%,Not enough data available,0:13,98,0.0%,0.0%,55,30,74%,96%,CMS identified issues with this plan's data,22%,20%,45%,19%,17%
H3335,"Excellus Health Plan, Inc","EXCELLUS HEALTH PLAN, INC.","Lifetime Healthcare, Inc.",68%,59%,93%,92%,86%,42%,91%,1:25,82%,97%,0.00%,81%,82%,38%,3%,53%,35,31,88,Not enough data available,42,56%,33%,57,78%,56%,89%,78%,50.00%,0.78%,0:29,5%,0.30%,100%,99,16.85%,83,0:04,98,0.0%,0.0%,28,7,75%,96%,2.43,13%,7%,43%,10%,8%
H3337,Liberty Health Advantage,"LIBERTY HEALTH ADVANTAGE, INC.","Liberty Health Advantage, Inc.",21%,47%,Not enough data available,92%,62%,51%,Not enough data available,1:06,54%,88%,1.60%,23%,61%,48%,3%,59%,50,43,82,Not enough data available,53,44%,7%,Insufficient data,67%,Not enough data available,67%,No data available,No data available,0.78%,0:33,5%,0.27%,100%,99,11.76%,Not enough data available,0:22,99,No data available,0.0%,50,31,72%,93%,4.54,37%,46%,15%,15%,22%
H3342,Empire BlueCross BlueShield,"EMPIRE HEALTHCHOICE ASSURANCE, INC.",Anthem Inc.,60%,60%,86%,93%,82%,59%,94%,0:18,70%,96%,6.40%,73%,77%,38%,5%,59%,41,35,82,Not enough data available,50,39%,5%,55,72%,65%,85%,79%,66.67%,6.40%,0:18,5%,0.48%,100%,99,16.67%,Not enough data available,0:20,99,No data available,No data available,44,15,74%,94%,CMS identified issues with this plan's data,20%,28%,44%,21%,19%
H3344,Independent Health,INDEPENDENT HEALTH BENEFITS CORPORATION,"Independent Health Association, Inc.",Not enough data available,Not enough data available,Not enough data available,92%,89%,42%,91%,0:32,84%,98%,0.78%,Not enough data available,Not enough data available,27%,7%,56%,45,33,87,Not enough data available,40,53%,20%,50,82%,Not enough data available,Not enough data available,100%,100.00%,0.78%,0:32,6%,0.29%,92%,100,5.26%,Not enough data available,0:10,98,No data available,13.3%,31,14,75%,No data available,1.57,6%,6%,40%,11%,8%
H3347,Elderplan,"ELDERPLAN, INC.","Elderplan, Inc.",35%,39%,88%,93%,67%,45%,Not enough data available,0:23,51%,92%,0.79%,75%,88%,40%,3%,62%,64,52,89,Not enough data available,62,40%,5%,66,72%,53%,71%,83%,100.00%,0.79%,0:23,5%,0.75%,100%,99,14.98%,Not enough data available,0:16,99,No data available,0.0%,54,38,75%,97%,CMS identified issues with this plan's data,14%,26%,29%,14%,5%
H3351,"Excellus Health Plan, Inc","EXCELLUS HEALTH PLAN, INC.","Lifetime Healthcare, Inc.",64%,59%,93%,93%,85%,39%,92%,1:25,88%,97%,0.00%,80%,86%,36%,4%,55%,36,29,92,Not enough data available,49,52%,34%,53,81%,59%,89%,90%,75.00%,0.78%,0:29,5%,0.44%,100%,99,15.58%,Not enough data available,0:04,98,0.0%,0.0%,33,12,79%,96%,2.87,15%,5%,58%,7%,8%
H3359,Healthfirst Medicare Plan,"HEALTHFIRST HEALTH PLAN, INC.","Healthfirst, Inc.",82%,44%,92%,95%,69%,51%,92%,1:12,68%,96%,0.78%,71%,91%,40%,5%,66%,64,52,91,97,57,44%,48%,Insufficient data,80%,62%,48%,100%,83.33%,0.78%,1:12,5%,0.28%,100%,99,17.66%,Not enough data available,0:13,98,No data available,No data available,57,52,81%,98%,0.68,18%,22%,27%,20%,15%
H3361,WellCare,"WELLCARE OF NEW YORK, INC.","WellCare Health Plans, Inc.",51%,41%,91%,93%,70%,39%,90%,0:20,58%,92%,1.31%,76%,85%,43%,6%,57%,57,54,92,94,66,Not enough data available,12%,77,75%,56%,68%,100%,87.50%,1.31%,0:20,5%,0.10%,100%,99,22.22%,Not enough data available,0:18,99,No data available,No data available,48,43,76%,99%,3.52,30%,29%,20%,18%,20%
H3362,Independent Health,"INDEPENDENT HEALTH ASSOCIATION, INC.","Independent Health Association, Inc.",73%,54%,98%,93%,86%,48%,90%,0:32,82%,98%,0.78%,80%,85%,38%,4%,55%,43,32,87,Not enough data available,43,51%,25%,49,77%,49%,86%,91%,81.82%,0.78%,0:32,6%,0.20%,96%,99,12.08%,90,0:10,98,13.3%,6.7%,32,12,75%,98%,1.97,22%,26%,28%,15%,13%
H3370,Empire BlueCross BlueShield,"EMPIRE HEALTHCHOICE HMO, INC.",Anthem Inc.,62%,55%,88%,93%,81%,52%,Not enough data available,0:23,73%,95%,1.56%,70%,75%,41%,5%,52%,50,38,77,Not enough data available,48,48%,5%,59,71%,55%,76%,93%,88.89%,1.56%,0:23,5%,0.35%,100%,99,17.52%,Not enough data available,0:20,99,6.7%,0.0%,49,18,74%,95%,CMS identified issues with this plan's data,29%,25%,45%,21%,18%
H3379,UnitedHealthcare,"UNITEDHEALTHCARE OF NEW YORK, INC.","UnitedHealth Group, Inc.",32%,51%,90%,94%,81%,38%,91%,0:12,55%,96%,1.08%,68%,77%,48%,3%,56%,57,38,81,Not enough data available,57,43%,6%,58,72%,54%,76%,100%,No data available,1.08%,0:12,5%,0.48%,100%,99,15.31%,Not enough data available,0:10,99,No data available,No data available,56,23,72%,98%,CMS identified issues with this plan's data,14%,20%,28%,14%,12%
H3384,BlueCross BlueShield of WNY and BlueShield of NENY,HEALTHNOW NEW YORK INC.,HealthNow New York Inc.,66%,52%,96%,93%,81%,39%,92%,0:18,75%,96%,0.39%,74%,80%,19%,4%,50%,38,30,90,Not enough data available,43,39%,27%,62,78%,49%,85%,100%,100.00%,0.39%,0:18,5%,0.34%,100%,100,16.80%,Not enough data available,0:17,98,No data available,No data available,34,16,75%,97%,0.14,10%,19%,48%,8%,6%
H3387,UnitedHealthcare,"UNITEDHEALTHCARE OF NEW YORK, INC.","UnitedHealth Group, Inc.",47%,48%,93%,94%,67%,62%,Not enough data available,0:03,59%,96%,0.76%,75%,90%,41%,5%,70%,71,60,91,Not enough data available,62,Not enough data available,6%,57,74%,55%,63%,100%,No data available,0.76%,0:03,5%,0.21%,100%,98,14.29%,Not enough data available,0:10,99,No data available,No data available,52,48,77%,No data available,0.98,17%,36%,13%,16%,15%
H3388,CDPHP Medicare Choices,"CAPITAL DISTRICT PHYSICIANS' HEALTH PLAN, INC.","Capital District Physicians' Health Plan, Inc.",81%,59%,95%,94%,90%,39%,92%,0:09,80%,98%,25.40%,80%,78%,36%,6%,54%,42,31,91,91,42,55%,29%,55,80%,57%,89%,67%,100.00%,1.57%,0:08,4%,0.17%,100%,101,19.51%,85,0:10,96,No data available,0.0%,40,10,76%,96%,CMS identified issues with this plan's data,15%,12%,51%,12%,10%
H3404,Blue Cross and Blue Shield of North Carolina,BLUE CROSS AND BLUE SHIELD OF NORTH CAROLINA,Blue Cross and Blue Shield of North Carolina,56%,55%,91%,94%,84%,39%,91%,0:10,79%,99%,0.78%,81%,73%,33%,2%,61%,54,43,92,Not enough data available,53,51%,31%,44,76%,63%,84%,93%,100.00%,0.78%,0:10,5%,0.54%,100%,100,14.42%,84,0:02,98,0.0%,0.0%,45,18,74%,96%,6.21,7%,4%,50%,6%,5%
