H5945,Prominence Health Plan,PROMINENCE HEALTHFIRST,"Universal Health Services, Inc.",Not enough data available,Not enough data available,Not enough data available,87%,No data available,Not enough data available,91%,0:03,71%,91%,0.00%,Not enough data available,Not enough data available,29%,0%,57%,34,33,82,Not enough data available,53,No data available,6%,Insufficient data,Not enough data available,Not enough data available,Not enough data available,0%,No data available,0.00%,0:03,5%,1.27%,92%,101,No data available,Not enough data available,0:08,98,No data available,No data available,27,14,79%,94%,5.68,No data available,No data available,No data available,No data available,No data available
H5969,AlohaCare,ALOHACARE,AlohaCare,Not enough data available,Not enough data available,Not enough data available,95%,Not enough data available,Not enough data available,No data available,0:03,No data available,96%,0.00%,Not enough data available,Not enough data available,Not enough data available,Not enough data available,No data available,No data available,No data available,No data available,No data available,No data available,Not enough data available,25%,136,Not enough data available,Not enough data available,Not enough data available,No data available,No data available,0.00%,0:03,4%,0.00%,100%,101,No data available,No data available,0:17,97,No data available,No data available,No data available,No data available,73%,No data available,Plan too small to be measured,No data available,No data available,No data available,No data available,No data available
H5970,Humana Insurance Company of New York,HUMANA INSURANCE COMPANY OF NEW YORK,Humana Inc.,62%,53%,93%,92%,81%,32%,89%,0:41,75%,96%,2.54%,71%,79%,37%,3%,53%,48,44,89,Not enough data available,49,51%,18%,52,76%,55%,69%,0%,100.00%,2.54%,0:41,4%,0.58%,100%,100,17.65%,Not enough data available,0:04,99,No data available,0.0%,50,24,73%,99%,CMS identified issues with this plan's data,22%,27%,39%,15%,20%
H5985,Phoenix Health Plans,"PHOENIX HEALTH PLANS, INC.",Tenet Healthcare Corporation,47%,49%,75%,90%,66%,43%,Not enough data available,0:15,68%,92%,2.38%,77%,75%,37%,1%,56%,42,38,87,Not enough data available,46,40%,5%,55,70%,51%,67%,100%,100.00%,2.38%,0:15,5%,0.22%,100%,102,No data available,Not enough data available,0:10,97,No data available,0.0%,30,13,70%,98%,CMS identified issues with this plan's data,26%,37%,14%,12%,18%
H5989,CenterLight Healthcare,"CENTERLIGHT HEALTHCARE, INC.","CenterLight Health System, Inc.",Not enough data available,Not enough data available,Not enough data available,100%,Not enough data available,Not enough data available,No data available,0:17,No data available,100%,2.44%,Not enough data available,Not enough data available,Not enough data available,Not enough data available,No data available,No data available,No data available,No data available,No data available,No data available,Not enough data available,Not enough data available,Insufficient data,Not enough data available,Not enough data available,Not enough data available,No data available,No data available,1.64%,0:16,7%,0.00%,100%,98,12.44%,No data available,0:16,100,No data available,No data available,No data available,No data available,75%,No data available,0.16,No data available,No data available,No data available,No data available,No data available
H5991,Affinity Health Plan,"AFFINITY HEALTH PLAN, INC.","Affinity Health Services Holdings, Inc.",56%,42%,Not enough data available,89%,67%,46%,90%,0:20,47%,94%,2.31%,76%,92%,34%,7%,58%,59,45,93,Not enough data available,61,Not enough data available,3%,Insufficient data,83%,70%,78%,No data available,No data available,1.56%,0:17,6%,0.10%,100%,101,No data available,Not enough data available,0:13,99,0.0%,20.0%,43,34,78%,96%,CMS identified issues with this plan's data,28%,36%,16%,20%,23%
H5992,Senior Whole Health of New York,"SENIOR WHOLE HEALTH OF NEW YORK, INC.","SWH Holdings, Inc.",Not enough data available,Not enough data available,Not enough data available,84%,No data available,Not enough data available,No data available,0:05,No data available,94%,1.56%,Not enough data available,Not enough data available,Not enough data available,Not enough data available,No data available,No data available,No data available,No data available,No data available,No data available,No data available,Not enough data available,Insufficient data,Not enough data available,Not enough data available,Not enough data available,No data available,No data available,1.56%,0:05,No data available,No data available,100%,125,No data available,No data available,0:18,92,No data available,No data available,No data available,No data available,No data available,No data available,Plan too small to be measured,No data available,No data available,No data available,No data available,No data available
H5995,ATRIO Health Plans,ATRIO HEALTH PLANS,ATRIO Health Plans,Not enough data available,61%,Not enough data available,95%,56%,15%,Not enough data available,0:15,62%,96%,0.00%,77%,89%,26%,1%,56%,38,34,91,Not enough data available,50,56%,3%,47,69%,57%,58%,100%,No data available,0.00%,0:15,6%,0.82%,100%,100,17.14%,Not enough data available,0:02,98,No data available,0.0%,25,26,74%,No data available,1.50,No data available,No data available,No data available,No data available,No data available
H6050,Kaiser Permanente Medicare Cost,"KAISER FOUNDATION HP, INC.","Kaiser Foundation Health Plan, Inc.",Not enough data available,Not enough data available,Not enough data available,93%,No data available,Not enough data available,No data available,Not enough data available,No data available,75%,Not enough data available,Not enough data available,Not enough data available,Not enough data available,Not enough data available,No data available,No data available,No data available,No data available,No data available,No data available,No data available,Not enough data available,Insufficient data,Not enough data available,Not enough data available,Not enough data available,Plan not required to report measure,Plan not required to report measure,Plan not required to report measure,Plan not required to report measure,Plan not required to report measure,Plan not required to report measure,Plan not required to report measure,Plan not required to report measure,Plan not required to report measure,Plan not required to report measure,Plan not required to report measure,Plan not required to report measure,Plan not required to report measure,Plan not required to report measure,Plan not required to report measure,Plan not required to report measure,Plan not required to report measure,No data available,Plan too small to be measured,No data available,No data available,No data available,No data available,No data available
H6052,Kaiser Permanente Medicare Cost,"KAISER FOUNDATION HP, INC.","Kaiser Foundation Health Plan, Inc.",Not enough data available,Not enough data available,Not enough data available,96%,Not enough data available,Not enough data available,92%,Not enough data available,89%,90%,Not enough data available,Not enough data available,Not enough data available,Not enough data available,Not enough data available,44%,44,12,93,Not enough data available,54,46%,Not enough data available,32,Not enough data available,Not enough data available,Not enough data available,Plan not required to report measure,Plan not required to report measure,Plan not required to report measure,Plan not required to report measure,Plan not required to report measure,Plan not required to report measure,Plan not required to report measure,Plan not required to report measure,Plan not required to report measure,Plan not required to report measure,Plan not required to report measure,Plan not required to report measure,Plan not required to report measure,Plan not required to report measure,Plan not required to report measure,Plan not required to report measure,Plan not required to report measure,No data available,4.06,No data available,No data available,No data available,No data available,No data available
H6080,Meridian Complete,"MERIDIAN HEALTH PLAN OF ILLINOIS, INC.","Caidan Enterprises, Inc.",34%,51%,Not enough data available,90%,No data available,Not enough data available,Not enough data available,0:38,44%,80%,0.78%,63%,79%,48%,7%,63%,54,53,89,Not enough data available,Not enough data available,No data available,20%,Insufficient data,Not enough data available,Not enough data available,Not enough data available,100%,100.00%,0.78%,0:38,6%,0.71%,92%,98,19.61%,Not enough data available,0:23,65,No data available,No data available,41,38,72%,No data available,5.49,No data available,No data available,No data available,No data available,No data available
H6229,Anthem Blue Cross Cal MediConnect,"BLUE CROSS OF CALIFORNIA PARTNERSHIP PLAN, INC.",Anthem Inc.,Not enough data available,46%,Not enough data available,89%,No data available,Not enough data available,Not enough data available,0:20,61%,71%,2.76%,58%,82%,13%,1%,Not enough data available,56,37,Not enough data available,Not enough data available,Not enough data available,No data available,0%,14,64%,Not enough data available,Not enough data available,100%,No data available,2.76%,0:20,5%,0.21%,96%,100,14.29%,Not enough data available,0:20,94,No data available,0.0%,38,32,72%,No data available,CMS identified issues with this plan's data,No data available,No data available,No data available,No data available,No data available
H6237,Regence BlueCross BlueShield of Oregon,REGENCE BLUECROSS BLUESHIELD OF OREGON,"Cambia Health Solutions, Inc.",Not enough data available,73%,Not enough data available,92%,85%,Not enough data available,Not enough data available,0:41,78%,94%,0.68%,Not enough data available,Not enough data available,44%,7%,53%,39,44,95,Not enough data available,51,50%,9%,16,Not enough data available,Not enough data available,Not enough data available,100%,100.00%,0.68%,0:41,4%,1.07%,100%,103,No data available,91,0:16,97,No data available,0.0%,29,14,67%,97%,CMS identified issues with this plan's data,18%,25%,21%,8%,12%
H6298,Medical Mutual of Ohio,HEALTHSPAN INTEGRATED CARE,Catholic Health Partners,Not enough data available,85%,Not enough data available,90%,No data available,Not enough data available,Not enough data available,0:26,74%,92%,0.00%,Not enough data available,Not enough data available,27%,0%,59%,40,28,91,Not enough data available,Not enough data available,No data available,6%,26,79%,Not enough data available,Not enough data available,No data available,No data available,0.00%,0:26,5%,1.38%,100%,100,No data available,Not enough data available,0:03,97,No data available,0.0%,26,11,79%,76%,CMS identified issues with this plan's data,29%,48%,22%,12%,23%
H6306,FirstMedicare Direct,FIRSTCAROLINACARE INSURANCE COMPANY,"FirstHealth of the Carolinas, Inc.",Not enough data available,61%,Not enough data available,96%,74%,Not enough data available,91%,0:20,84%,98%,0.00%,83%,88%,34%,0%,57%,43,36,91,Not enough data available,56,50%,50%,39,76%,Not enough data available,Not enough data available,100%,100.00%,0.00%,0:20,4%,0.25%,100%,101,No data available,Not enough data available,0:06,99,No data available,No data available,36,19,77%,63%,2.38,17%,23%,17%,9%,11%
H6308,AgeWell New York FIDA Plan,"AGEWELL NEW YORK, LLC","ParkerCare New York, LLC",Not enough data available,Not enough data available,Not enough data available,Not enough data available,No data available,Not enough data available,No data available,0:07,No data available,Not enough data available,0.00%,Not enough data available,Not enough data available,Not enough data available,Not enough data available,No data available,No data available,No data available,No data available,No data available,No data available,No data available,Not enough data available,Insufficient data,Not enough data available,Not enough data available,Not enough data available,No data available,No data available,2.36%,0:35,No data available,No data available,100%,No data available,No data available,No data available,0:20,99,No data available,No data available,No data available,No data available,No data available,No data available,Plan too small to be measured,No data available,No data available,No data available,No data available,No data available
H6320,Fresenius Health Plans,"FRESENIUS HEALTH PLANS OF NORTH CAROLINA, INC.",Fresenius Medicare Care AG & Co. KGaA,Plan too new to be measured,Plan too new to be measured,Plan too new to be measured,Plan too new to be measured,No data available,Plan too new to be measured,Plan too new to be measured,0:02,Plan too new to be measured,Plan too new to be measured,2.41%,Plan too new to be measured,Plan too new to be measured,Plan too new to be measured,Plan too new to be measured,Plan too new to be measured,Plan too new to be measured,Plan too new to be measured,Plan too new to be measured,Plan too new to be measured,Plan too new to be measured,No data available,Plan too new to be measured,Plan too new to be measured,Plan too new to be measured,Plan too new to be measured,Plan too new to be measured,Plan too new to be measured,Plan too new to be measured,Plan too new to be measured,Plan too new to be measured,Plan too new to be measured,Plan too new to be measured,Plan too new to be measured,Plan too new to be measured,Plan too new to be measured,Plan too new to be measured,Plan too new to be measured,Plan too new to be measured,Plan too new to be measured,Plan too new to be measured,Plan too new to be measured,Plan too new to be measured,Plan too new to be measured,Plan too new to be measured,Plan too new to be measured,Plan too new to be measured,Plan too new to be measured,Plan too new to be measured,Plan too new to be measured,Plan too new to be measured
H6328,Care NÆ Care Insurance Company,"CARE N' CARE INSURANCE COMPANY, INC.",North Texas Specialty Physicians,Not enough data available,56%,97%,93%,84%,48%,91%,0:16,76%,95%,1.56%,46%,54%,26%,4%,49%,33,32,86,Not enough data available,49,52%,3%,89,76%,36%,91%,33%,86.67%,0.79%,0:10,5%,0.53%,100%,99,33.33%,87,0:09,98,0.0%,6.7%,29,12,77%,88%,1.27,23%,47%,20%,8%,13%
H6360,HealthSpan,HEALTHSPAN INTEGRATED CARE,Catholic Health Partners,69%,73%,80%,94%,83%,48%,90%,Not enough data available,87%,95%,Not enough data available,63%,75%,28%,1%,57%,42,28,96,94,51,52%,18%,36,82%,Not enough data available,Not enough data available,0%,No data available,No data available,No data available,5%,0.97%,100%,96,19.78%,82,No data available,94,No data available,0.0%,15,14,87%,No data available,CMS identified issues with this plan's data,No data available,No data available,No data available,No data available,No data available
H6361,"Today's Options of New York, Inc.","TODAY'S OPTIONS OF NEW YORK, INC.",Universal American Corp.,Plan too new to be measured,Plan too new to be measured,Plan too new to be measured,Plan too new to be measured,No data available,Plan too new to be measured,Plan too new to be measured,0:12,Plan too new to be measured,Plan too new to be measured,0.00%,Plan too new to be measured,Plan too new to be measured,Plan too new to be measured,Plan too new to be measured,Plan too new to be measured,Plan too new to be measured,Plan too new to be measured,Plan too new to be measured,Plan too new to be measured,Plan too new to be measured,No data available,Plan too new to be measured,Plan too new to be measured,Plan too new to be measured,Plan too new to be measured,Plan too new to be measured,Plan too new to be measured,Plan too new to be measured,Plan too new to be measured,Plan too new to be measured,Plan too new to be measured,Plan too new to be measured,Plan too new to be measured,Plan too new to be measured,Plan too new to be measured,Plan too new to be measured,Plan too new to be measured,Plan too new to be measured,Plan too new to be measured,Plan too new to be measured,Plan too new to be measured,Plan too new to be measured,Plan too new to be measured,Plan too new to be measured,Plan too new to be measured,Plan too new to be measured,Plan too new to be measured,Plan too new to be measured,Plan too new to be measured,Plan too new to be measured
H6396,CareSource,CARESOURCE,CareSource Management Group Co.,Plan too new to be measured,Plan too new to be measured,Plan too new to be measured,Plan too new to be measured,No data available,Plan too new to be measured,Plan too new to be measured,Plan too new to be measured,Plan too new to be measured,Plan too new to be measured,Plan too new to be measured,Plan too new to be measured,Plan too new to be measured,Plan too new to be measured,Plan too new to be measured,Plan too new to be measured,Plan too new to be measured,Plan too new to be measured,Plan too new to be measured,Plan too new to be measured,Plan too new to be measured,No data available,Plan too new to be measured,Plan too new to be measured,Plan too new to be measured,Plan too new to be measured,Plan too new to be measured,Plan too new to be measured,Plan too new to be measured,Plan too new to be measured,Plan too new to be measured,Plan too new to be measured,Plan too new to be measured,Plan too new to be measured,Plan too new to be measured,Plan too new to be measured,Plan too new to be measured,Plan too new to be measured,Plan too new to be measured,Plan too new to be measured,Plan too new to be measured,Plan too new to be measured,Plan too new to be measured,Plan too new to be measured,Plan too new to be measured,Plan too new to be measured,Plan too new to be measured,Plan too new to be measured,Plan too new to be measured,Plan too new to be measured,Plan too new to be measured
H6435,RiverSpring FIDA Plan,"ELDERSERVE HEALTH, INC.",Riverspring Health Holding Corp.,Not enough data available,Not enough data available,Not enough data available,Not enough data available,No data available,Not enough data available,No data available,0:09,No data available,Not enough data available,0.00%,Not enough data available,Not enough data available,Not enough data available,Not enough data available,No data available,No data available,No data available,No data available,No data available,No data available,No data available,Not enough data available,Insufficient data,Not enough data available,Not enough data available,Not enough data available,No data available,No data available,0.00%,0:31,No data available,No data available,96%,No data available,No data available,No data available,0:25,42,No data available,No data available,No data available,No data available,No data available,No data available,CMS identified issues with this plan's data,No data available,No data available,No data available,No data available,No data available
H6453,HMO Louisiana,"HMO LOUISIANA, INC.",Louisiana Health Service & Indemnity Company,Plan too new to be measured,Plan too new to be measured,Plan too new to be measured,Plan too new to be measured,No data available,Plan too new to be measured,Plan too new to be measured,0:06,Plan too new to be measured,Plan too new to be measured,0.00%,Plan too new to be measured,Plan too new to be measured,Plan too new to be measured,Plan too new to be measured,Plan too new to be measured,Plan too new to be measured,Plan too new to be measured,Plan too new to be measured,Plan too new to be measured,Plan too new to be measured,No data available,Plan too new to be measured,Plan too new to be measured,Plan too new to be measured,Plan too new to be measured,Plan too new to be measured,Plan too new to be measured,Plan too new to be measured,Plan too new to be measured,Plan too new to be measured,Plan too new to be measured,Plan too new to be measured,Plan too new to be measured,Plan too new to be measured,Plan too new to be measured,Plan too new to be measured,Plan too new to be measured,Plan too new to be measured,Plan too new to be measured,Plan too new to be measured,Plan too new to be measured,Plan too new to be measured,Plan too new to be measured,Plan too new to be measured,Plan too new to be measured,Plan too new to be measured,Plan too new to be measured,Plan too new to be measured,Plan too new to be measured,Plan too new to be measured
H6528,UnitedHealthcare,CARE IMPROVEMENT PLUS SOUTH CENTRAL INSURANCE CO.,"UnitedHealth Group, Inc.",24%,49%,91%,91%,62%,33%,89%,0:18,68%,96%,2.10%,75%,74%,34%,2%,60%,53,42,82,Not enough data available,50,44%,8%,70,72%,51%,59%,100%,No data available,2.10%,0:18,6%,0.52%,100%,99,14.55%,Not enough data available,0:10,98,No data available,No data available,43,26,73%,97%,3.15,12%,13%,36%,9%,13%
H6609,Humana Insurance Company,HUMANA INSURANCE COMPANY,Humana Inc.,53%,58%,93%,92%,75%,33%,91%,0:56,74%,97%,1.97%,76%,79%,33%,2%,61%,47,40,82,Not enough data available,57,44%,10%,56,76%,62%,76%,91%,81.82%,1.97%,0:56,5%,0.61%,100%,99,16.08%,84,0:04,98,6.7%,6.7%,47,28,75%,97%,CMS identified issues with this plan's data,18%,24%,41%,11%,12%
H6622,Humana WI Health Organization Insurance Corp,HUMANA WI HEALTH ORGANIZATION INSURANCE CORP,Humana Inc.,54%,54%,89%,95%,75%,37%,92%,0:38,78%,97%,2.78%,79%,85%,21%,2%,67%,56,46,94,93,60,46%,20%,35,72%,55%,73%,100%,No data available,2.78%,0:38,4%,1.25%,100%,99,11.11%,83,0:04,99,0.0%,6.7%,50,30,80%,96%,CMS identified issues with this plan's data,21%,19%,23%,9%,18%
H6623,Maricopa Care Advantage,MARICOPA COUNTY SPECIAL HEALTH CARE DISTRICT,MARICOPA COUNTY SPECIAL HEALTH CARE DISTRICT,19%,61%,Not enough data available,91%,60%,Not enough data available,Not enough data available,0:23,68%,93%,0.00%,74%,82%,28%,1%,63%,45,49,87,Not enough data available,54,Not enough data available,1%,Insufficient data,89%,Not enough data available,Not enough data available,No data available,No data available,0.00%,0:23,5%,0.00%,100%,100,No data available,Not enough data available,0:13,98,No data available,0.0%,40,30,74%,No data available,5.29,No data available,No data available,No data available,No data available,No data available
H6672,Eon Health,"EON HEALTH, INC. (GA)","Eon Health Plan, LLC",Plan too new to be measured,Plan too new to be measured,Plan too new to be measured,Plan too new to be measured,No data available,Plan too new to be measured,Plan too new to be measured,Plan too new to be measured,Plan too new to be measured,Plan too new to be measured,Plan too new to be measured,Plan too new to be measured,Plan too new to be measured,Plan too new to be measured,Plan too new to be measured,Plan too new to be measured,Plan too new to be measured,Plan too new to be measured,Plan too new to be measured,Plan too new to be measured,Plan too new to be measured,No data available,Plan too new to be measured,Plan too new to be measured,Plan too new to be measured,Plan too new to be measured,Plan too new to be measured,Plan too new to be measured,Plan too new to be measured,Plan too new to be measured,Plan too new to be measured,Plan too new to be measured,Plan too new to be measured,Plan too new to be measured,Plan too new to be measured,Plan too new to be measured,Plan too new to be measured,Plan too new to be measured,Plan too new to be measured,Plan too new to be measured,Plan too new to be measured,Plan too new to be measured,Plan too new to be measured,Plan too new to be measured,Plan too new to be measured,Plan too new to be measured,Plan too new to be measured,Plan too new to be measured,Plan too new to be measured,Plan too new to be measured,Plan too new to be measured
H6723,Medical Mutual of Ohio,MEDICAL MUTUAL OF OHIO,MEDICAL MUTUAL OF OHIO,Plan too new to be measured,Plan too new to be measured,Plan too new to be measured,Plan too new to be measured,No data available,Plan too new to be measured,Plan too new to be measured,0:49,Plan too new to be measured,Plan too new to be measured,0.00%,Plan too new to be measured,Plan too new to be measured,Plan too new to be measured,Plan too new to be measured,Plan too new to be measured,Plan too new to be measured,Plan too new to be measured,Plan too new to be measured,Plan too new to be measured,Plan too new to be measured,No data available,Plan too new to be measured,Plan too new to be measured,Plan too new to be measured,Plan too new to be measured,Plan too new to be measured,Plan too new to be measured,Plan too new to be measured,Plan too new to be measured,Plan too new to be measured,Plan too new to be measured,Plan too new to be measured,Plan too new to be measured,Plan too new to be measured,Plan too new to be measured,Plan too new to be measured,Plan too new to be measured,Plan too new to be measured,Plan too new to be measured,Plan too new to be measured,Plan too new to be measured,Plan too new to be measured,Plan too new to be measured,Plan too new to be measured,Plan too new to be measured,Plan too new to be measured,Plan too new to be measured,Plan too new to be measured,Plan too new to be measured,Plan too new to be measured
H6743,ATRIO Health Plans,ATRIO HEALTH PLANS,ATRIO Health Plans,Not enough data available,57%,87%,90%,73%,21%,87%,0:15,76%,94%,0.00%,78%,77%,28%,3%,48%,28,23,84,Not enough data available,43,45%,6%,45,70%,57%,67%,50%,100.00%,0.00%,0:15,6%,0.53%,100%,100,No data available,Not enough data available,0:02,98,0.0%,0.0%,13,11,68%,97%,2.23,11%,7%,24%,6%,4%
H6745,Amida Care,AMIDA CARE INC.,Amida Care Inc.,Not enough data available,Not enough data available,Not enough data available,87%,No data available,Not enough data available,No data available,1:07,No data available,88%,0.00%,Not enough data available,Not enough data available,39%,13%,No data available,No data available,No data available,No data available,No data available,No data available,No data available,0%,Insufficient data,Not enough data available,Not enough data available,Not enough data available,No data available,No data available,0.00%,0:15,12%,0.00%,100%,99,No data available,No data available,0:20,100,No data available,0.0%,No data available,No data available,60%,100%,CMS identified issues with this plan's data,No data available,No data available,No data available,No data available,No data available
