H9190,Gateway Health Medicare Assured,"GATEWAY HEALTH PLAN OF OHIO, INC.","Gateway Health Plan, LP",23%,73%,Not enough data available,88%,59%,Not enough data available,Not enough data available,0:17,61%,90%,0.24%,66%,73%,43%,2%,64%,48,46,89,Not enough data available,51,43%,12%,Insufficient data,Not enough data available,Not enough data available,Not enough data available,No data available,No data available,0.24%,0:17,5%,0.48%,100%,101,No data available,Not enough data available,0:17,93,No data available,No data available,50,36,73%,98%,9.19,38%,40%,19%,13%,24%
H9207,Health Partners Medicare,"HEALTH PARTNERS PLANS, INC.","Health Partners Plans, Inc.",53%,40%,94%,94%,50%,Not enough data available,91%,0:28,65%,97%,0.76%,79%,93%,37%,3%,61%,57,56,90,Not enough data available,56,39%,29%,42,77%,45%,67%,75%,No data available,0.76%,0:28,4%,0.10%,100%,99,No data available,83,0:26,98,No data available,No data available,51,49,79%,97%,9.71,21%,29%,30%,12%,15%
H9208,RiverLink Health,RIVERLINK HEALTH,Catholic Health Initiatives,Not enough data available,Not enough data available,Not enough data available,93%,No data available,Not enough data available,91%,0:20,76%,96%,0.00%,Not enough data available,Not enough data available,Not enough data available,Not enough data available,61%,42,36,96,Not enough data available,47,No data available,16%,Insufficient data,Not enough data available,Not enough data available,Not enough data available,0%,No data available,0.00%,0:20,5%,0.04%,100%,101,No data available,Not enough data available,0:06,96,No data available,0.0%,32,12,82%,96%,CMS identified issues with this plan's data,40%,49%,18%,12%,30%
H9276,Sunshine Health Medicare Advantage,"SUNSHINE HEALTH COMMUNITY SOLUTIONS, INC.",Centene Corporation,Plan too new to be measured,Plan too new to be measured,Plan too new to be measured,Plan too new to be measured,No data available,Plan too new to be measured,Plan too new to be measured,Plan too new to be measured,Plan too new to be measured,Plan too new to be measured,Plan too new to be measured,Plan too new to be measured,Plan too new to be measured,Plan too new to be measured,Plan too new to be measured,Plan too new to be measured,Plan too new to be measured,Plan too new to be measured,Plan too new to be measured,Plan too new to be measured,Plan too new to be measured,No data available,Plan too new to be measured,Plan too new to be measured,Plan too new to be measured,Plan too new to be measured,Plan too new to be measured,Plan too new to be measured,Plan too new to be measured,Plan too new to be measured,Plan too new to be measured,Plan too new to be measured,Plan too new to be measured,Plan too new to be measured,Plan too new to be measured,Plan too new to be measured,Plan too new to be measured,Plan too new to be measured,Plan too new to be measured,Plan too new to be measured,Plan too new to be measured,Plan too new to be measured,Plan too new to be measured,Plan too new to be measured,Plan too new to be measured,Plan too new to be measured,Plan too new to be measured,Plan too new to be measured,Plan too new to be measured,Plan too new to be measured,Plan too new to be measured
H9287,"Health Net of Arizona, Inc.","HEALTH NET COMMUNITY SOLUTIONS OF ARIZONA, INC.",Centene Corporation,Plan too new to be measured,Plan too new to be measured,Plan too new to be measured,Plan too new to be measured,No data available,Plan too new to be measured,Plan too new to be measured,Plan too new to be measured,Plan too new to be measured,Plan too new to be measured,Plan too new to be measured,Plan too new to be measured,Plan too new to be measured,Plan too new to be measured,Plan too new to be measured,Plan too new to be measured,Plan too new to be measured,Plan too new to be measured,Plan too new to be measured,Plan too new to be measured,Plan too new to be measured,No data available,Plan too new to be measured,Plan too new to be measured,Plan too new to be measured,Plan too new to be measured,Plan too new to be measured,Plan too new to be measured,Plan too new to be measured,Plan too new to be measured,Plan too new to be measured,Plan too new to be measured,Plan too new to be measured,Plan too new to be measured,Plan too new to be measured,Plan too new to be measured,Plan too new to be measured,Plan too new to be measured,Plan too new to be measured,Plan too new to be measured,Plan too new to be measured,Plan too new to be measured,Plan too new to be measured,Plan too new to be measured,Plan too new to be measured,Plan too new to be measured,Plan too new to be measured,Plan too new to be measured,Plan too new to be measured,Plan too new to be measured,Plan too new to be measured
H9302,Soundpath Health,SOUNDPATH HEALTH,Catholic Health Initiatives,Not enough data available,57%,93%,89%,80%,26%,90%,0:45,80%,94%,0.79%,78%,81%,28%,1%,52%,38,32,89,Not enough data available,43,43%,12%,31,83%,61%,71%,0%,100.00%,0.79%,0:45,4%,0.48%,100%,100,9.09%,85,0:11,99,0.0%,0.0%,23,10,76%,92%,CMS identified issues with this plan's data,28%,31%,19%,6%,16%
H9312,Fresenius Health Plans,FRESENIUS HEALTH PLANS INSURANCE COMPANY,Fresenius Medicare Care AG & Co. KGaA,Plan too new to be measured,Plan too new to be measured,Plan too new to be measured,Plan too new to be measured,No data available,Plan too new to be measured,Plan too new to be measured,0:02,Plan too new to be measured,Plan too new to be measured,1.78%,Plan too new to be measured,Plan too new to be measured,Plan too new to be measured,Plan too new to be measured,Plan too new to be measured,Plan too new to be measured,Plan too new to be measured,Plan too new to be measured,Plan too new to be measured,Plan too new to be measured,No data available,Plan too new to be measured,Plan too new to be measured,Plan too new to be measured,Plan too new to be measured,Plan too new to be measured,Plan too new to be measured,Plan too new to be measured,Plan too new to be measured,Plan too new to be measured,Plan too new to be measured,Plan too new to be measured,Plan too new to be measured,Plan too new to be measured,Plan too new to be measured,Plan too new to be measured,Plan too new to be measured,Plan too new to be measured,Plan too new to be measured,Plan too new to be measured,Plan too new to be measured,Plan too new to be measured,Plan too new to be measured,Plan too new to be measured,Plan too new to be measured,Plan too new to be measured,Plan too new to be measured,Plan too new to be measured,Plan too new to be measured,Plan too new to be measured
H9345,VillageCareMAX Full Advantage FIDA,VILLAGE SENIOR SERVICES CORPORATION,"Village Care of New York, Inc.",Not enough data available,Not enough data available,Not enough data available,Not enough data available,No data available,Not enough data available,No data available,0:09,No data available,Not enough data available,2.40%,Not enough data available,Not enough data available,Not enough data available,Not enough data available,No data available,No data available,No data available,No data available,No data available,No data available,No data available,Not enough data available,Insufficient data,Not enough data available,Not enough data available,Not enough data available,No data available,No data available,0.00%,0:14,No data available,No data available,100%,No data available,No data available,No data available,0:09,99,No data available,No data available,No data available,No data available,No data available,No data available,CMS identified issues with this plan's data,No data available,No data available,No data available,No data available,No data available
H9403,Eon Health,"EON HEALTH, INC. (SC)","Eon Health Plan, LLC",Plan too new to be measured,Plan too new to be measured,Plan too new to be measured,Plan too new to be measured,No data available,Plan too new to be measured,Plan too new to be measured,Plan too new to be measured,Plan too new to be measured,Plan too new to be measured,Plan too new to be measured,Plan too new to be measured,Plan too new to be measured,Plan too new to be measured,Plan too new to be measured,Plan too new to be measured,Plan too new to be measured,Plan too new to be measured,Plan too new to be measured,Plan too new to be measured,Plan too new to be measured,No data available,Plan too new to be measured,Plan too new to be measured,Plan too new to be measured,Plan too new to be measured,Plan too new to be measured,Plan too new to be measured,Plan too new to be measured,Plan too new to be measured,Plan too new to be measured,Plan too new to be measured,Plan too new to be measured,Plan too new to be measured,Plan too new to be measured,Plan too new to be measured,Plan too new to be measured,Plan too new to be measured,Plan too new to be measured,Plan too new to be measured,Plan too new to be measured,Plan too new to be measured,Plan too new to be measured,Plan too new to be measured,Plan too new to be measured,Plan too new to be measured,Plan too new to be measured,Plan too new to be measured,Plan too new to be measured,Plan too new to be measured,Plan too new to be measured
H9408,Vibra Health Plan,"VIBRA HEALTH PLAN, INC.","Vibra Health Plan Holdings, LLC",Plan too new to be measured,Plan too new to be measured,Plan too new to be measured,Plan too new to be measured,No data available,Plan too new to be measured,Plan too new to be measured,Plan too new to be measured,Plan too new to be measured,Plan too new to be measured,Plan too new to be measured,Plan too new to be measured,Plan too new to be measured,Plan too new to be measured,Plan too new to be measured,Plan too new to be measured,Plan too new to be measured,Plan too new to be measured,Plan too new to be measured,Plan too new to be measured,Plan too new to be measured,No data available,Plan too new to be measured,Plan too new to be measured,Plan too new to be measured,Plan too new to be measured,Plan too new to be measured,Plan too new to be measured,Plan too new to be measured,Plan too new to be measured,Plan too new to be measured,Plan too new to be measured,Plan too new to be measured,Plan too new to be measured,Plan too new to be measured,Plan too new to be measured,Plan too new to be measured,Plan too new to be measured,Plan too new to be measured,Plan too new to be measured,Plan too new to be measured,Plan too new to be measured,Plan too new to be measured,Plan too new to be measured,Plan too new to be measured,Plan too new to be measured,Plan too new to be measured,Plan too new to be measured,Plan too new to be measured,Plan too new to be measured,Plan too new to be measured
H9412,Geisinger Gold,"GEISINGER QUALITY OPTIONS, INC.",Geisinger Health System,Not enough data available,Not enough data available,Not enough data available,91%,77%,Not enough data available,No data available,0:21,No data available,97%,0.00%,Not enough data available,Not enough data available,Not enough data available,Not enough data available,No data available,No data available,No data available,No data available,No data available,No data available,Not enough data available,35%,107,82%,Not enough data available,Not enough data available,92%,77.78%,0.00%,0:20,6%,0.70%,100%,100,No data available,No data available,0:05,99,No data available,0.0%,No data available,No data available,73%,89%,Plan too small to be measured,25%,39%,27%,15%,15%
H9460,Cigna-HealthSpring,"CIGNA HEALTHCARE OF ST LOUIS, INC.",CIGNA,Plan too new to be measured,Plan too new to be measured,Plan too new to be measured,Plan too new to be measured,No data available,Plan too new to be measured,Plan too new to be measured,1:42,Plan too new to be measured,Plan too new to be measured,4.44%,Plan too new to be measured,Plan too new to be measured,Plan too new to be measured,Plan too new to be measured,Plan too new to be measured,Plan too new to be measured,Plan too new to be measured,Plan too new to be measured,Plan too new to be measured,Plan too new to be measured,No data available,Plan too new to be measured,Plan too new to be measured,Plan too new to be measured,Plan too new to be measured,Plan too new to be measured,Plan too new to be measured,Plan too new to be measured,Plan too new to be measured,Plan too new to be measured,Plan too new to be measured,Plan too new to be measured,Plan too new to be measured,Plan too new to be measured,Plan too new to be measured,Plan too new to be measured,Plan too new to be measured,Plan too new to be measured,Plan too new to be measured,Plan too new to be measured,Plan too new to be measured,Plan too new to be measured,Plan too new to be measured,Plan too new to be measured,Plan too new to be measured,Plan too new to be measured,Plan too new to be measured,Plan too new to be measured,Plan too new to be measured,Plan too new to be measured
H9487,Fidelis SecureCare of Michigan,FIDELIS SECURECARE OF MICHIGAN,Centene Corporation,Plan too new to be measured,Plan too new to be measured,Plan too new to be measured,Plan too new to be measured,No data available,Plan too new to be measured,Not enough data available,0:17,45%,Plan too new to be measured,1.57%,Plan too new to be measured,Plan too new to be measured,Plan too new to be measured,Plan too new to be measured,Not enough data available,46,42,Not enough data available,Not enough data available,Not enough data available,No data available,Plan too new to be measured,Plan too new to be measured,Plan too new to be measured,Plan too new to be measured,Plan too new to be measured,Plan too new to be measured,Plan too new to be measured,Plan too new to be measured,Plan too new to be measured,Plan too new to be measured,Plan too new to be measured,Plan too new to be measured,Plan too new to be measured,Plan too new to be measured,Not enough data available,Plan too new to be measured,Plan too new to be measured,Plan too new to be measured,Plan too new to be measured,52,38,Plan too new to be measured,Plan too new to be measured,Plan too new to be measured,Plan too new to be measured,Plan too new to be measured,Plan too new to be measured,Plan too new to be measured,Plan too new to be measured
H9492,StableView Health,STABLEVIEW HEALTH,Catholic Health Initiatives,Not enough data available,Not enough data available,Not enough data available,86%,No data available,Not enough data available,No data available,0:51,No data available,92%,0.00%,Not enough data available,Not enough data available,Not enough data available,Not enough data available,No data available,No data available,No data available,No data available,No data available,No data available,No data available,Not enough data available,Insufficient data,Not enough data available,Not enough data available,Not enough data available,No data available,No data available,0.00%,0:51,No data available,No data available,100%,99,No data available,No data available,0:07,99,No data available,0.0%,No data available,No data available,No data available,No data available,Plan too small to be measured,No data available,No data available,No data available,No data available,No data available
H9525,Anthem Blue Cross and Blue Shield,COMPCARE HEALTH SERVICES INSURANCE CORPORATION,Anthem Inc.,Not enough data available,68%,Not enough data available,91%,76%,Not enough data available,91%,0:22,76%,95%,1.61%,Not enough data available,Not enough data available,37%,4%,63%,53,43,87,Not enough data available,58,38%,38%,57,80%,Not enough data available,Not enough data available,No data available,No data available,1.61%,0:22,4%,0.35%,100%,98,No data available,Not enough data available,0:20,98,No data available,No data available,42,23,76%,96%,CMS identified issues with this plan's data,22%,17%,34%,19%,21%
H9572,Blue Cross Blue Shield of Michigan,BCBS OF MICHIGAN MUTUAL INSURANCE COMPANY,Blue Cross Blue Shield of Michigan Mutual Insuranc,65%,66%,94%,91%,81%,40%,92%,1:34,78%,97%,0.00%,74%,78%,42%,3%,54%,38,33,79,91,42,48%,17%,Insufficient data,75%,71%,88%,100%,No data available,0.00%,1:34,5%,0.40%,100%,102,12.16%,Not enough data available,0:17,97,0.0%,6.7%,36,14,75%,96%,0.04,10%,9%,46%,9%,10%
H9576,NEIGHBORHOOD HEALTH PLAN OF RHODE ISLAND,NEIGHBORHOOD HEALTH PLAN OF RHODE ISLAND,NEIGHBORHOOD HEALTH PLAN OF RHODE ISLAND,Plan too new to be measured,Plan too new to be measured,Plan too new to be measured,Plan too new to be measured,No data available,Plan too new to be measured,Plan too new to be measured,Plan too new to be measured,Plan too new to be measured,Plan too new to be measured,Plan too new to be measured,Plan too new to be measured,Plan too new to be measured,Plan too new to be measured,Plan too new to be measured,Plan too new to be measured,Plan too new to be measured,Plan too new to be measured,Plan too new to be measured,Plan too new to be measured,Plan too new to be measured,No data available,Plan too new to be measured,Plan too new to be measured,Plan too new to be measured,Plan too new to be measured,Plan too new to be measured,Plan too new to be measured,Plan too new to be measured,Plan too new to be measured,Plan too new to be measured,Plan too new to be measured,Plan too new to be measured,Plan too new to be measured,Plan too new to be measured,Plan too new to be measured,Plan too new to be measured,Plan too new to be measured,Plan too new to be measured,Plan too new to be measured,Plan too new to be measured,Plan too new to be measured,Plan too new to be measured,Plan too new to be measured,Plan too new to be measured,Plan too new to be measured,Plan too new to be measured,Plan too new to be measured,Plan too new to be measured,Plan too new to be measured,Plan too new to be measured
H9585,BMC HealthNet Plan Senior Care Options,"BOSTON MEDICAL CENTER HEALTH PLAN, INC.","BMC Health System, Inc.",Plan too new to be measured,Plan too new to be measured,Plan too new to be measured,Plan too new to be measured,No data available,Plan too new to be measured,Plan too new to be measured,0:01,Plan too new to be measured,Plan too new to be measured,0.00%,Plan too new to be measured,Plan too new to be measured,Plan too new to be measured,Plan too new to be measured,Plan too new to be measured,Plan too new to be measured,Plan too new to be measured,Plan too new to be measured,Plan too new to be measured,Plan too new to be measured,No data available,Plan too new to be measured,Plan too new to be measured,Plan too new to be measured,Plan too new to be measured,Plan too new to be measured,Plan too new to be measured,Plan too new to be measured,Plan too new to be measured,Plan too new to be measured,Plan too new to be measured,Plan too new to be measured,Plan too new to be measured,Plan too new to be measured,Plan too new to be measured,Plan too new to be measured,Plan too new to be measured,Plan too new to be measured,Plan too new to be measured,Plan too new to be measured,Plan too new to be measured,Plan too new to be measured,Plan too new to be measured,Plan too new to be measured,Plan too new to be measured,Plan too new to be measured,Plan too new to be measured,Plan too new to be measured,Plan too new to be measured,Plan too new to be measured
H9589,Eon Health,"EON HEALTH, INC. (GA)","Eon Health Plan, LLC",Plan too new to be measured,Plan too new to be measured,Plan too new to be measured,Plan too new to be measured,No data available,Plan too new to be measured,Plan too new to be measured,Plan too new to be measured,Plan too new to be measured,Plan too new to be measured,Plan too new to be measured,Plan too new to be measured,Plan too new to be measured,Plan too new to be measured,Plan too new to be measured,Plan too new to be measured,Plan too new to be measured,Plan too new to be measured,Plan too new to be measured,Plan too new to be measured,Plan too new to be measured,No data available,Plan too new to be measured,Plan too new to be measured,Plan too new to be measured,Plan too new to be measured,Plan too new to be measured,Plan too new to be measured,Plan too new to be measured,Plan too new to be measured,Plan too new to be measured,Plan too new to be measured,Plan too new to be measured,Plan too new to be measured,Plan too new to be measured,Plan too new to be measured,Plan too new to be measured,Plan too new to be measured,Plan too new to be measured,Plan too new to be measured,Plan too new to be measured,Plan too new to be measured,Plan too new to be measured,Plan too new to be measured,Plan too new to be measured,Plan too new to be measured,Plan too new to be measured,Plan too new to be measured,Plan too new to be measured,Plan too new to be measured,Plan too new to be measured
H9595,Molina Healthcare of Virginia,"MOLINA HEALTHCARE OF VIRGINIA, INC.","Molina Healthcare, Inc.,",Plan too new to be measured,Plan too new to be measured,Plan too new to be measured,Plan too new to be measured,No data available,Plan too new to be measured,Plan too new to be measured,Plan too new to be measured,Plan too new to be measured,Plan too new to be measured,Plan too new to be measured,Plan too new to be measured,Plan too new to be measured,Plan too new to be measured,Plan too new to be measured,Plan too new to be measured,Plan too new to be measured,Plan too new to be measured,Plan too new to be measured,Plan too new to be measured,Plan too new to be measured,No data available,Plan too new to be measured,Plan too new to be measured,Plan too new to be measured,Plan too new to be measured,Plan too new to be measured,Plan too new to be measured,Plan too new to be measured,Plan too new to be measured,Plan too new to be measured,Plan too new to be measured,Plan too new to be measured,Plan too new to be measured,Plan too new to be measured,Plan too new to be measured,Plan too new to be measured,Plan too new to be measured,Plan too new to be measured,Plan too new to be measured,Plan too new to be measured,Plan too new to be measured,Plan too new to be measured,Plan too new to be measured,Plan too new to be measured,Plan too new to be measured,Plan too new to be measured,Plan too new to be measured,Plan too new to be measured,Plan too new to be measured,Plan too new to be measured
H9615,MVP HEALTH CARE,"MVP HEALTH PLAN, INC.","MVP Health Care, Inc.",Not enough data available,64%,95%,94%,86%,38%,91%,1:46,84%,97%,1.54%,82%,89%,38%,4%,53%,40,29,88,93,45,50%,19%,62,81%,75%,89%,100%,100.00%,1.54%,1:21,4%,0.92%,100%,101,13.11%,84,0:10,98,No data available,No data available,36,11,79%,95%,0.24,6%,6%,51%,8%,7%
H9689,Health Alliance Medicare,"HEALTH ALLIANCE CONNECT, INC.",The Carle Foundation,Not enough data available,Not enough data available,Not enough data available,96%,No data available,Not enough data available,No data available,0:28,No data available,100%,1.61%,Not enough data available,Not enough data available,Not enough data available,Not enough data available,No data available,No data available,No data available,No data available,No data available,No data available,No data available,38%,Insufficient data,Not enough data available,Not enough data available,Not enough data available,No data available,No data available,1.61%,0:28,2%,0.00%,100%,101,No data available,No data available,0:58,99,No data available,0.0%,No data available,No data available,80%,No data available,Plan too small to be measured,No data available,No data available,No data available,No data available,No data available
H9699,Health Advantage,"HMO PARTNERS, INC.",USAble Mutual Insurance Company,Not enough data available,Not enough data available,Not enough data available,86%,No data available,Not enough data available,No data available,0:28,No data available,92%,0.79%,Not enough data available,Not enough data available,Not enough data available,Not enough data available,No data available,No data available,No data available,No data available,No data available,No data available,No data available,23%,Insufficient data,Not enough data available,Not enough data available,Not enough data available,No data available,No data available,0.00%,0:32,5%,0.00%,100%,106,No data available,No data available,0:07,97,No data available,0.0%,No data available,No data available,59%,97%,Plan too small to be measured,No data available,No data available,No data available,No data available,No data available
H9712,HAP Midwest MI Health Link,"HAP MIDWEST HEALTH PLAN, INC.",Henry Ford Health System,Plan too new to be measured,Plan too new to be measured,Plan too new to be measured,Plan too new to be measured,No data available,Plan too new to be measured,Not enough data available,0:53,48%,Plan too new to be measured,0.00%,Plan too new to be measured,Plan too new to be measured,Plan too new to be measured,Plan too new to be measured,54%,42,41,77,Not enough data available,Not enough data available,No data available,Plan too new to be measured,Plan too new to be measured,Plan too new to be measured,Plan too new to be measured,Plan too new to be measured,Plan too new to be measured,Plan too new to be measured,Plan too new to be measured,Plan too new to be measured,Plan too new to be measured,Plan too new to be measured,Plan too new to be measured,Plan too new to be measured,Plan too new to be measured,Not enough data available,Plan too new to be measured,Plan too new to be measured,Plan too new to be measured,Plan too new to be measured,45,24,Plan too new to be measured,Plan too new to be measured,Plan too new to be measured,Plan too new to be measured,Plan too new to be measured,Plan too new to be measured,Plan too new to be measured,Plan too new to be measured
H9725,Cigna-Healthspring,"CIGNA HEALTHCARE OF NORTH CAROLINA, INC.",CIGNA,25%,71%,Not enough data available,95%,74%,Not enough data available,92%,1:35,76%,96%,3.82%,82%,80%,32%,3%,60%,52,43,91,Not enough data available,58,46%,23%,84,76%,Not enough data available,Not enough data available,No data available,66.67%,3.82%,1:35,5%,0.94%,100%,101,No data available,Not enough data available,0:10,99,0.0%,6.7%,45,27,76%,95%,3.50,36%,45%,14%,18%,21%
